byte_infer_perf/llm_perf/backends/ROCM/test_moe_int8/E=8,N=1792,device_name=AMD_Instinct_MI308X_OAM.json
{
    "1": {
        "BLOCK_SIZE_M": 16,
        "BLOCK_SIZE_N": 32,
        "BLOCK_SIZE_K": 32,
        "GROUP_SIZE_M": 1,
        "num_warps": 2,
        "num_stages": 0
    },
    "2": {
        "BLOCK_SIZE_M": 16,
        "BLOCK_SIZE_N": 256,
        "BLOCK_SIZE_K": 32,
        "GROUP_SIZE_M": 1,
        "num_warps": 1,
        "num_stages": 0
    },
    "4": {
        "BLOCK_SIZE_M": 16,
        "BLOCK_SIZE_N": 32,
        "BLOCK_SIZE_K": 64,
        "GROUP_SIZE_M": 1,
        "num_warps": 1,
        "num_stages": 0
    },
    "8": {
        "BLOCK_SIZE_M": 16,
        "BLOCK_SIZE_N": 16,
        "BLOCK_SIZE_K": 32,
        "GROUP_SIZE_M": 1,
        "num_warps": 4,
        "num_stages": 0
    },
    "16": {
        "BLOCK_SIZE_M": 16,
        "BLOCK_SIZE_N": 16,
        "BLOCK_SIZE_K": 32,
        "GROUP_SIZE_M": 1,
        "num_warps": 2,
        "num_stages": 0
    },
    "24": {
        "BLOCK_SIZE_M": 16,
        "BLOCK_SIZE_N": 16,
        "BLOCK_SIZE_K": 64,
        "GROUP_SIZE_M": 1,
        "num_warps": 2,
        "num_stages": 0
    },
    "32": {
        "BLOCK_SIZE_M": 16,
        "BLOCK_SIZE_N": 16,
        "BLOCK_SIZE_K": 64,
        "GROUP_SIZE_M": 1,
        "num_warps": 4,
        "num_stages": 0
    },
    "48": {
        "BLOCK_SIZE_M": 16,
        "BLOCK_SIZE_N": 16,
        "BLOCK_SIZE_K": 32,
        "GROUP_SIZE_M": 4,
        "num_warps": 2,
        "num_stages": 0
    },
    "64": {
        "BLOCK_SIZE_M": 16,
        "BLOCK_SIZE_N": 16,
        "BLOCK_SIZE_K": 256,
        "GROUP_SIZE_M": 4,
        "num_warps": 8,
        "num_stages": 0
    },
    "96": {
        "BLOCK_SIZE_M": 16,
        "BLOCK_SIZE_N": 16,
        "BLOCK_SIZE_K": 16,
        "GROUP_SIZE_M": 4,
        "num_warps": 4,
        "num_stages": 0
    },
    "128": {
        "BLOCK_SIZE_M": 16,
        "BLOCK_SIZE_N": 16,
        "BLOCK_SIZE_K": 16,
        "GROUP_SIZE_M": 1,
        "num_warps": 4,
        "num_stages": 0
    },
    "256": {
        "BLOCK_SIZE_M": 16,
        "BLOCK_SIZE_N": 16,
        "BLOCK_SIZE_K": 16,
        "GROUP_SIZE_M": 1,
        "num_warps": 2,
        "num_stages": 0
    },
    "512": {
        "BLOCK_SIZE_M": 16,
        "BLOCK_SIZE_N": 16,
        "BLOCK_SIZE_K": 64,
        "GROUP_SIZE_M": 1,
        "num_warps": 8,
        "num_stages": 0
    },
    "1024": null,
    "1536": null,
    "2048": null,
    "3072": null,
    "4096": null
}
